{
  "name": "M42_HDR_Jan2025",
  "type": "LRGB",
  "calibration": {
    "bias": "2025_01_15",
    "darks": "2025_01_20",
    "flats": "2025_01_19"
  },
  "lights": {
    "L": [
      "M42/2025_01_15/L180",
      "M42/2025_01_15/L30",
      "M42/2025_01_16/L180"
    ],
    "R": ["M42/2025_01_15/R180", "M42/2025_01_15/R30"],
    "G": ["M42/2025_01_15/G180", "M42/2025_01_15/G30"],
    "B": ["M42/2025_01_15/B180", "M42/2025_01_15/B30"]
  },
  "output": "M42/processed",
  "options": {
    "temp_tolerance": 2
  }
}
