{
  "name": "IC2118_Dec2024",
  "type": "LRGB",
  "calibration": {
    "bias": "2024_08_05",
    "darks": "2025_01_23",
    "flats": "2025_01_19"
  },
  "lights": {
    "L": [
      "IC2118/2024_11_29/L180",
      "IC2118/2024_11_30/L180",
      "IC2118/2024_12_01/L180",
      "IC2118/2024_12_02/L180"
    ],
    "R": [
      "IC2118/2024_11_29/R180",
      "IC2118/2024_11_30/R180",
      "IC2118/2024_12_01/R180",
      "IC2118/2024_12_02/R180"
    ],
    "G": [
      "IC2118/2024_11_29/G180",
      "IC2118/2024_11_30/G180",
      "IC2118/2024_12_01/G180",
      "IC2118/2024_12_02/G180"
    ],
    "B": [
      "IC2118/2024_11_30/B180",
      "IC2118/2024_12_01/B180",
      "IC2118/2024_12_02/B180"
    ]
  },
  "output": "IC2118/processed",
  "options": {
    "dark_temp_override": -10,
    "deconv_enabled": true
  }
}
