{
  "name": "M42_Jan2025",
  "type": "LRGB",
  "calibration": {
    "bias": "2024_08_05",
    "darks": "2025_01_23",
    "flats": "2025_01_19"
  },
  "lights": {
    "L": [
      "M42/2025_01_17/L10",
      "M42/2025_01_18/L10",
      "M42/2025_01_21/L10",
      "M42/2025_01_22/L10",
      "M42/2025_01_15/L30",
      "M42/2025_01_16/L30",
      "M42/2025_01_15/L180",
      "M42/2025_01_16/L180",
      "M42/2025_01_17/L180",
      "M42/2025_01_18/L180",
      "M42/2025_01_21/L180",
      "M42/2025_01_22/L180",
      "M42/2025_01_27/L180",
      "M42/2025_01_28/L180",
      "M42/2025_01_29/L180"
    ],
    "R": [
      "M42/2025_01_17/R10",
      "M42/2025_01_21/R10",
      "M42/2025_01_22/R10",
      "M42/2025_01_15/R30",
      "M42/2025_01_16/R30",
      "M42/2025_01_15/R180",
      "M42/2025_01_16/R180",
      "M42/2025_01_17/R180",
      "M42/2025_01_21/R180",
      "M42/2025_01_22/R180",
      "M42/2025_01_26/R180",
      "M42/2025_01_27/R180",
      "M42/2025_01_28/R180",
      "M42/2025_01_29/R180"
    ],
    "G": [
      "M42/2025_01_16/G30",
      "M42/2025_01_16/G180",
      "M42/2025_01_17/G180",
      "M42/2025_01_21/G180",
      "M42/2025_01_22/G180",
      "M42/2025_01_26/G180",
      "M42/2025_01_27/G180",
      "M42/2025_01_28/G180",
      "M42/2025_01_29/G180"
    ],
    "B": [
      "M42/2025_01_17/B10",
      "M42/2025_01_21/B10",
      "M42/2025_01_22/B10",
      "M42/2025_01_16/B30",
      "M42/2025_01_17/B180",
      "M42/2025_01_21/B180",
      "M42/2025_01_22/B180",
      "M42/2025_01_26/B180",
      "M42/2025_01_27/B180",
      "M42/2025_01_28/B180",
      "M42/2025_01_29/B180"
    ]
  },
  "output": "M42/processed",
  "options": {
    "temp_tolerance": 2,
    "dark_temp_override": -10,
    "hdr_low_threshold": 0.7,
    "hdr_high_threshold": 0.9,
    "saturation_amount": 1.0
  }
}
