{
  "name": "M31_Fall2024",
  "type": "LRGB",
  "calibration": {
    "bias": "2024_08_05",
    "darks": "2025_01_23",
    "flats": "2025_01_19"
  },
  "lights": {
    "L": [
      "M31/2024_10_05/L180",
      "M31/2024_11_06/L180",
      "M31/2024_11_07/L180"
    ],
    "R": [
      "M31/2024_10_05/R180",
      "M31/2024_11_06/R180",
      "M31/2024_11_07/R180"
    ],
    "G": [
      "M31/2024_10_05/G180",
      "M31/2024_11_06/G180",
      "M31/2024_11_07/G180"
    ],
    "B": [
      "M31/2024_10_05/B180",
      "M31/2024_11_06/B180",
      "M31/2024_11_07/B180"
    ]
  },
  "output": "M31/processed",
  "options": {
    "dark_temp_override": -10,
    "deconv_enabled": true,
    "color_removal_mode": "none",
    "spcc_enabled": false
  }
}
